{
    "id": 0,
    "label": "string",
    "floor": 0,
    "area": 5,
    "sensors": 3,
    "geometry": {
      "type": "string",
      "projection": "string",
      "coordinates": [
        {
          "type": "string",
          "projection": "string",
          "coordinates": {
            "latitude": 0,
            "longitude": 0
          }
        }
      ]
    }
}